{
    "name": "大学计算机科学专业知识图谱",
    "introduction": "",
    "tag": "",
    "knowledges": [
        {
            "name": "网络编程",
            "tag": "",
            "introduction": "网络编程涉及使用编程语言开发网络应用程序和通信协议。"
        },
        {
            "name": "计算机网络",
            "tag": "",
            "introduction": "网络是计算机之间相互连接的通信系统，使得信息可以传递和共享。"
        },
        {
            "name": "并行计算",
            "tag": "",
            "introduction": "并行计算是利用多个处理单元同时执行计算任务，以提高计算性能。"
        },
        {
            "name": "物联网",
            "tag": "",
            "introduction": "物联网是通过互联网使各种物体互相连接和通信的技术。"
        },
        {
            "name": "分布式系统",
            "tag": "",
            "introduction": "分布式系统是由多台计算机组成的网络系统，共同完成特定任务。"
        },
        {
            "name": "网络协议",
            "tag": "",
            "introduction": "网络协议是在计算机网络中实现通信的一组规则和约定。"
        },
        {
            "name": "计算机组成原理",
            "tag": "",
            "introduction": "计算机组成原理研究计算机硬件组成和工作原理，包括处理器、存储器、输入输出等。"
        },
        {
            "name": "分布式计算",
            "tag": "",
            "introduction": "分布式计算是将计算任务分配给网络中多个计算节点进行处理的方式。"
        },
        {
            "name": "计算机体系结构",
            "tag": "",
            "introduction": "计算机体系结构研究计算机硬件组件以及它们之间的交互和通信方式。"
        },
        {
            "name": "操作系统",
            "tag": "",
            "introduction": "操作系统是计算机硬件与应用程序之间的核心软件，负责管理计算机资源。"
        },
        {
            "name": "人工智能",
            "tag": "",
            "introduction": "人工智能是研究和开发能够模拟、延伸和扩展人类智能的技术和应用。"
        },
        {
            "name": "离散数学",
            "tag": "",
            "introduction": "离散数学研究离散结构，包括集合、图论、逻辑等，为计算机科学提供理论基础。"
        },
        {
            "name": "云计算",
            "tag": "",
            "introduction": "云计算提供通过互联网访问计算资源和服务的方式，如服务器、存储和数据库等。"
        },
        {
            "name": "人机交互",
            "tag": "",
            "introduction": "人机交互研究如何使计算机与人之间的交流更加友好和高效。"
        },
        {
            "name": "计算机安全",
            "tag": "",
            "introduction": "计算机安全研究如何保护计算机系统和信息免受未授权访问和损害。"
        },
        {
            "name": "软件工程",
            "tag": "",
            "introduction": "软件工程是研究和应用工程原则来开发和维护高质量软件的学科。"
        },
        {
            "name": "人工智能伦理学",
            "tag": "",
            "introduction": "人工智能伦理学探讨人工智能在社会和道德层面所带来的影响和挑战。"
        },
        {
            "name": "机器学习",
            "tag": "",
            "introduction": "机器学习是人工智能的一个分支，研究计算机系统如何从数据中学习和改进性能。"
        },
        {
            "name": "数据结构",
            "tag": "",
            "introduction": "数据结构是计算机科学中研究数据组织和处理的基本原理和方法。"
        },
        {
            "name": "高等数学",
            "tag": "",
            "introduction": "数学是计算机科学的基础，涉及数理逻辑和算法等重要概念。"
        },
        {
            "name": "软件测试",
            "tag": "",
            "introduction": "软件测试是评估和改进软件质量的过程，以发现和修复缺陷。"
        },
        {
            "name": "嵌入式系统",
            "tag": "",
            "introduction": "嵌入式系统是集成在其他设备或系统中的计算机系统，用于控制和实时处理。"
        },
        {
            "name": "SQL语言",
            "tag": "",
            "introduction": "SQL是结构化查询语言，用于在关系数据库中执行查询和操作。"
        },
        {
            "name": "关系数据库",
            "tag": "",
            "introduction": "关系数据库是基于关系模型的数据库，采用表格结构组织数据。"
        },
        {
            "name": "数据库",
            "tag": "",
            "introduction": "数据库是用于存储、管理和检索数据的软件系统。"
        },
        {
            "name": "程序设计",
            "tag": "",
            "introduction": "程序设计是计算机科学的入门课程，学习如何使用编程语言实现算法和解决问题。"
        },
        {
            "name": "编译原理",
            "tag": "",
            "introduction": "编译原理研究将高级程序代码翻译成机器可执行代码的原理和方法。"
        },
        {
            "name": "面向对象编程",
            "tag": "",
            "introduction": "面向对象编程是一种编程范式，它以对象为基本单位，将数据和操作封装在一起。"
        },
        {
            "name": "计算机图形学",
            "tag": "",
            "introduction": "计算机图形学是研究如何在计算机上表示和操作图像的学科。"
        },
        {
            "name": "算法设计与分析",
            "tag": "",
            "introduction": "算法设计与分析研究计算的概念、模型和算法，是理论计算机科学的核心领域之一。"
        },
        {
            "name": "自然语言处理",
            "tag": "",
            "introduction": "自然语言处理是让计算机理解、分析和生成自然语言文本的技术。"
        },
        {
            "name": "计算机视觉",
            "tag": "",
            "introduction": "计算机视觉是让计算机通过摄像头或摄像机等设备获得信息并进行处理的技术。"
        },
        {
            "name": "图像处理",
            "tag": "",
            "introduction": "图像处理涉及使用计算机对图像进行分析、增强、还原和压缩等处理。"
        },
        {
            "name": "虚拟现实",
            "tag": "",
            "introduction": "虚拟现实技术通过计算机生成的虚拟环境，使用户身临其境地体验。"
        }
    ],
    "edges": [
        {
            "from": 0,
            "to": 1,
            "tag": ""
        },
        {
            "from": 6,
            "to": 1,
            "tag": ""
        },
        {
            "from": 1,
            "to": 2,
            "tag": ""
        },
        {
            "from": 1,
            "to": 3,
            "tag": ""
        },
        {
            "from": 1,
            "to": 4,
            "tag": ""
        },
        {
            "from": 1,
            "to": 5,
            "tag": ""
        },
        {
            "from": 11,
            "to": 6,
            "tag": ""
        },
        {
            "from": 4,
            "to": 7,
            "tag": ""
        },
        {
            "from": 6,
            "to": 8,
            "tag": ""
        },
        {
            "from": 6,
            "to": 9,
            "tag": ""
        },
        {
            "from": 6,
            "to": 10,
            "tag": ""
        },
        {
            "from": 9,
            "to": 12,
            "tag": ""
        },
        {
            "from": 33,
            "to": 13,
            "tag": ""
        },
        {
            "from": 9,
            "to": 14,
            "tag": ""
        },
        {
            "from": 25,
            "to": 15,
            "tag": ""
        },
        {
            "from": 10,
            "to": 16,
            "tag": ""
        },
        {
            "from": 10,
            "to": 17,
            "tag": ""
        },
        {
            "from": 11,
            "to": 25,
            "tag": ""
        },
        {
            "from": 25,
            "to": 18,
            "tag": ""
        },
        {
            "from": 19,
            "to": 11,
            "tag": ""
        },
        {
            "from": 19,
            "to": 28,
            "tag": ""
        },
        {
            "from": 15,
            "to": 20,
            "tag": ""
        },
        {
            "from": 9,
            "to": 21,
            "tag": ""
        },
        {
            "from": 24,
            "to": 22,
            "tag": ""
        },
        {
            "from": 24,
            "to": 23,
            "tag": ""
        },
        {
            "from": 18,
            "to": 24,
            "tag": ""
        },
        {
            "from": 18,
            "to": 25,
            "tag": ""
        },
        {
            "from": 25,
            "to": 26,
            "tag": ""
        },
        {
            "from": 25,
            "to": 27,
            "tag": ""
        },
        {
            "from": 27,
            "to": 28,
            "tag": ""
        },
        {
            "from": 18,
            "to": 29,
            "tag": ""
        },
        {
            "from": 28,
            "to": 30,
            "tag": ""
        },
        {
            "from": 28,
            "to": 31,
            "tag": ""
        },
        {
            "from": 30,
            "to": 32,
            "tag": ""
        },
        {
            "from": 31,
            "to": 33,
            "tag": ""
        }
    ],
    "courses": []
}