{
    "name": "大学计算机科学专业知识图谱",
    "introduction": "这是一个大学计算机科学专业的知识图谱示例。",
    "knowledges": [
        {
            "name": "程序设计",
            "tag": "程序设计",
            "introduction": "编程语言是计算机与人之间交流的桥梁，用于编写计算机程序的形式化语言。"
        },
        {
            "name": "数据结构",
            "tag": "数据处理",
            "introduction": "数据结构与算法是计算机科学中研究数据组织和处理的基本原理和方法。"
        },
        {
            "name": "计算机体系结构",
            "tag": "计算机硬件",
            "introduction": "计算机体系结构研究计算机硬件组件以及它们之间的交互和通信方式。"
        },
        {
            "name": "面向对象编程",
            "tag": "面向对象",
            "introduction": "面向对象编程是一种编程范式，它以对象为基本单位，将数据和操作封装在一起。"
        },
        {
            "name": "数据类型与变量",
            "tag": "编程基础",
            "introduction": "数据类型与变量是编程语言中用于存储和操作数据的基本概念。"
        },
        {
            "name": "数据库",
            "tag": "数据存储",
            "introduction": "数据库是用于存储、管理和检索数据的软件系统。"
        },
        {
            "name": "关系数据库",
            "tag": "数据库类型",
            "introduction": "关系数据库是基于关系模型的数据库，采用表格结构组织数据。"
        },
        {
            "name": "SQL语言",
            "tag": "数据库查询",
            "introduction": "SQL是结构化查询语言，用于在关系数据库中执行查询和操作。"
        },
        {
            "name": "人工智能",
            "tag": "智能系统",
            "introduction": "人工智能是研究和开发能够模拟、延伸和扩展人类智能的技术和应用。"
        },
        {
            "name": "机器学习",
            "tag": "智能算法",
            "introduction": "机器学习是人工智能的一个分支，研究计算机系统如何从数据中学习和改进性能。"
        },
        {
            "name": "操作系统",
            "tag": "系统软件",
            "introduction": "操作系统是计算机硬件与应用程序之间的核心软件，负责管理计算机资源。"
        },
        {
            "name": "进程与线程",
            "tag": "并发与并行",
            "introduction": "进程与线程是操作系统中用于执行程序的基本执行单元。"
        },
        {
            "name": "计算机网络",
            "tag": "通信技术",
            "introduction": "网络是计算机之间相互连接的通信系统，使得信息可以传递和共享。"
        },
        {
            "name": "网络协议",
            "tag": "通信规则",
            "introduction": "网络协议是在计算机网络中实现通信的一组规则和约定。"
        },
        {
            "name": "软件工程",
            "tag": "软件开发",
            "introduction": "软件工程是研究和应用工程原则来开发和维护高质量软件的学科。"
        },
        {
            "name": "软件生命周期",
            "tag": "开发过程",
            "introduction": "软件生命周期是软件从概念到退役的全过程，包括开发、测试和维护。"
        },
        {
            "name": "计算机图形学",
            "tag": "图像处理",
            "introduction": "计算机图形学是研究如何在计算机上表示和操作图像的学科。"
        },
        {
            "name": "三维建模",
            "tag": "图形渲染",
            "introduction": "三维建模是创建三维物体模型的过程，图形渲染是将模型转化为图像的过程。"
        },
        {
            "name": "计算机安全",
            "tag": "信息安全",
            "introduction": "计算机安全研究如何保护计算机系统和信息免受未授权访问和损害。"
        },
        {
            "name": "加密技术",
            "tag": "数据保护",
            "introduction": "加密技术用于保护数据的机密性和完整性，防止未经授权的访问和篡改。"
        },
        {
            "name": "分布式系统",
            "tag": "系统架构",
            "introduction": "分布式系统是由多台计算机组成的网络系统，共同完成特定任务。"
        },
        {
            "name": "分布式计算",
            "tag": "资源共享",
            "introduction": "分布式计算是将计算任务分配给网络中多个计算节点进行处理的方式。"
        },
        {
            "name": "计算机视觉",
            "tag": "感知技术",
            "introduction": "计算机视觉是让计算机通过摄像头或摄像机等设备获得信息并进行处理的技术。"
        },
        {
            "name": "自然语言处理",
            "tag": "语言技术",
            "introduction": "自然语言处理是让计算机理解、分析和生成自然语言文本的技术。"
        },
        {
            "name": "人机交互",
            "tag": "用户体验",
            "introduction": "人机交互研究如何使计算机与人之间的交流更加友好和高效。"
        },
        {
            "name": "编译原理",
            "tag": "程序翻译",
            "introduction": "编译原理研究将高级程序代码翻译成机器可执行代码的原理和方法。"
        },
        {
            "name": "软件测试",
            "tag": "质量保障",
            "introduction": "软件测试是评估和改进软件质量的过程，以发现和修复缺陷。"
        },
        {
            "name": "云计算",
            "tag": "计算服务",
            "introduction": "云计算提供通过互联网访问计算资源和服务的方式，如服务器、存储和数据库等。"
        },
        {
            "name": "物联网",
            "tag": "智能连接",
            "introduction": "物联网是通过互联网使各种物体互相连接和通信的技术。"
        }
    ],
    "edges": [
        {
            "from": 0,
            "to": 1,
            "tag": "基础知识"
        },
        {
            "from": 0,
            "to": 3,
            "tag": "进阶知识"
        },
        {
            "from": 1,
            "to": 4,
            "tag": "基础知识"
        },
        {
            "from": 3,
            "to": 4,
            "tag": "关联知识"
        },
        {
            "from": 2,
            "to": 5,
            "tag": "基础知识"
        },
        {
            "from": 5,
            "to": 6,
            "tag": "关联知识"
        },
        {
            "from": 5,
            "to": 7,
            "tag": "关联知识"
        },
        {
            "from": 8,
            "to": 9,
            "tag": "基础知识"
        },
        {
            "from": 8,
            "to": 10,
            "tag": "关联知识"
        },
        {
            "from": 11,
            "to": 12,
            "tag": "基础知识"
        },
        {
            "from": 12,
            "to": 13,
            "tag": "关联知识"
        },
        {
            "from": 11,
            "to": 14,
            "tag": "进阶知识"
        },
        {
            "from": 2,
            "to": 15,
            "tag": "进阶知识"
        },
        {
            "from": 15,
            "to": 16,
            "tag": "关联知识"
        },
        {
            "from": 15,
            "to": 17,
            "tag": "关联知识"
        },
        {
            "from": 2,
            "to": 18,
            "tag": "进阶知识"
        },
        {
            "from": 18,
            "to": 19,
            "tag": "关联知识"
        },
        {
            "from": 2,
            "to": 20,
            "tag": "进阶知识"
        },
        {
            "from": 20,
            "to": 21,
            "tag": "关联知识"
        },
        {
            "from": 15,
            "to": 22,
            "tag": "进阶知识"
        },
        {
            "from": 22,
            "to": 23,
            "tag": "关联知识"
        },
        {
            "from": 15,
            "to": 24,
            "tag": "进阶知识"
        },
        {
            "from": 24,
            "to": 25,
            "tag": "关联知识"
        },
        {
            "from": 15,
            "to": 26,
            "tag": "进阶知识"
        },
        {
            "from": 26,
            "to": 27,
            "tag": "关联知识"
        },
        {
            "from": 2,
            "to": 28,
            "tag": "进阶知识"
        },
        {
            "from": 28,
            "to": 29,
            "tag": "关联知识"
        },
        {
            "from": 13,
            "to": 30,
            "tag": "基础知识"
        },
        {
            "from": 13,
            "to": 31,
            "tag": "进阶知识"
        },
        {
            "from": 30,
            "to": 31,
            "tag": "关联知识"
        },
        {
            "from": 6,
            "to": 32,
            "tag": "进阶知识"
        },
        {
            "from": 6,
            "to": 33,
            "tag": "进阶知识"
        },
        {
            "from": 32,
            "to": 33,
            "tag": "关联知识"
        },
        {
            "from": 16,
            "to": 34,
            "tag": "进阶知识"
        },
        {
            "from": 16,
            "to": 35,
            "tag": "进阶知识"
        },
        {
            "from": 34,
            "to": 35,
            "tag": "关联知识"
        },
        {
            "from": 8,
            "to": 36,
            "tag": "进阶知识"
        },
        {
            "from": 8,
            "to": 37,
            "tag": "进阶知识"
        },
        {
            "from": 36,
            "to": 37,
            "tag": "关联知识"
        },
        {
            "from": 9,
            "to": 38,
            "tag": "进阶知识"
        },
        {
            "from": 9,
            "to": 39,
            "tag": "进阶知识"
        },
        {
            "from": 38,
            "to": 39,
            "tag": "关联知识"
        },
        {
            "from": 19,
            "to": 40,
            "tag": "基础知识"
        },
        {
            "from": 13,
            "to": 40,
            "tag": "关联知识"
        },
        {
            "from": 40,
            "to": 41,
            "tag": "进阶知识"
        },
        {
            "from": 19,
            "to": 42,
            "tag": "基础知识"
        },
        {
            "from": 42,
            "to": 43,
            "tag": "关联知识"
        },
        {
            "from": 42,
            "to": 44,
            "tag": "关联知识"
        },
        {
            "from": 14,
            "to": 45,
            "tag": "进阶知识"
        },
        {
            "from": 14,
            "to": 46,
            "tag": "进阶知识"
        },
        {
            "from": 45,
            "to": 46,
            "tag": "关联知识"
        },
        {
            "from": 17,
            "to": 47,
            "tag": "进阶知识"
        },
        {
            "from": 17,
            "to": 48,
            "tag": "进阶知识"
        },
        {
            "from": 47,
            "to": 48,
            "tag": "关联知识"
        },
        {
            "from": 18,
            "to": 49,
            "tag": "进阶知识"
        },
        {
            "from": 18,
            "to": 50,
            "tag": "进阶知识"
        },
        {
            "from": 49,
            "to": 50,
            "tag": "关联知识"
        }
    ],
    "courses": [

    ]
}
